{
  "$schema": "https://wstein.github.io/cube-assembler/schemas/fixture-meta.schema.json",
  "gridSize": 4,
  "colorsURFDLB": "YWGGYBWOYYOROORR ORWGOROGBBGBYOBG YWWBGROGGBYWOBYB RBGOYYGOWGYRWWYB ROYWBBRRYWOGWRRG RWYWOGWBORWBYRGB",
  "detectedURFDLB": "YWGGYBWOYYOROORR ORWGOROGBBGBYOBG YWWBGROGGBYWOBYB RBGOYYGOWGYRWWYB ROYWBBRRYWOGWRRG RWYWOGWBORWBYRGB",
  "faces": {
    "u": {
      "photo": "face-u.jpg",
      "readings": [
        [
          172,
          191,
          26
        ],
        [
          161,
          168,
          171
        ],
        [
          0,
          143,
          39
        ],
        [
          1,
          145,
          42
        ],
        [
          160,
          188,
          37
        ],
        [
          4,
          53,
          109
        ],
        [
          168,
          172,
          176
        ],
        [
          231,
          83,
          48
        ],
        [
          167,
          193,
          40
        ],
        [
          175,
          192,
          23
        ],
        [
          229,
          71,
          29
        ],
        [
          165,
          8,
          22
        ],
        [
          238,
          87,
          51
        ],
        [
          231,
          73,
          27
        ],
        [
          172,
          10,
          24
        ],
        [
          179,
          8,
          18
        ]
      ],
      "confidences": [
        93,
        86,
        93,
        94,
        90,
        95,
        89,
        98,
        93,
        93,
        95,
        93,
        99,
        96,
        95,
        95
      ],
      "source": "camera",
      "capturedAt": "2026-09-27T09:06:12.932Z",
      "background": {
        "r": 118.78705180111477,
        "g": 96.30048043592801,
        "b": 83.40823535121045
      },
      "frame": {
        "width": 1920,
        "height": 1080
      },
      "crop": {
        "x": 725,
        "y": 306,
        "width": 435,
        "height": 435
      },
      "sharpness": 38.4,
      "camera": {
        "aspectRatio": 1.7777777777777777,
        "backgroundBlur": false,
        "frameRate": 30,
        "height": 1080,
        "resizeMode": "none",
        "width": 1920
      },
      "previewColorProfile": {
        "id": "generic-colors",
        "name": "Generic colors",
        "colors": {
          "W": {
            "r": 174,
            "g": 186,
            "b": 206
          },
          "Y": {
            "r": 179,
            "g": 202,
            "b": 73
          },
          "O": {
            "r": 217,
            "g": 87,
            "b": 66
          },
          "R": {
            "r": 176,
            "g": 41,
            "b": 71
          },
          "G": {
            "r": 46,
            "g": 166,
            "b": 86
          },
          "B": {
            "r": 28,
            "g": 98,
            "b": 172
          }
        }
      }
    },
    "r": {
      "photo": "face-r.jpg",
      "readings": [
        [
          229,
          78,
          43
        ],
        [
          171,
          15,
          31
        ],
        [
          178,
          172,
          173
        ],
        [
          1,
          163,
          52
        ],
        [
          223,
          84,
          57
        ],
        [
          185,
          43,
          57
        ],
        [
          235,
          90,
          55
        ],
        [
          27,
          161,
          69
        ],
        [
          14,
          61,
          120
        ],
        [
          9,
          52,
          106
        ],
        [
          6,
          144,
          50
        ],
        [
          1,
          63,
          120
        ],
        [
          186,
          206,
          51
        ],
        [
          234,
          78,
          40
        ],
        [
          5,
          54,
          110
        ],
        [
          1,
          157,
          49
        ]
      ],
      "confidences": [
        97,
        96,
        90,
        96,
        95,
        96,
        98,
        97,
        98,
        94,
        93,
        98,
        98,
        98,
        95,
        98
      ],
      "source": "camera",
      "capturedAt": "2026-09-27T09:06:16.456Z",
      "background": {
        "r": 121.01687418540806,
        "g": 99.56422450847175,
        "b": 87.32135132137212
      },
      "frame": {
        "width": 1920,
        "height": 1080
      },
      "crop": {
        "x": 735,
        "y": 306,
        "width": 435,
        "height": 435
      },
      "sharpness": 33.5,
      "camera": {
        "aspectRatio": 1.7777777777777777,
        "backgroundBlur": false,
        "frameRate": 30,
        "height": 1080,
        "resizeMode": "none",
        "width": 1920
      },
      "previewColorProfile": {
        "id": "generic-colors",
        "name": "Generic colors",
        "colors": {
          "W": {
            "r": 174,
            "g": 186,
            "b": 206
          },
          "Y": {
            "r": 179,
            "g": 202,
            "b": 73
          },
          "O": {
            "r": 217,
            "g": 87,
            "b": 66
          },
          "R": {
            "r": 176,
            "g": 41,
            "b": 71
          },
          "G": {
            "r": 46,
            "g": 166,
            "b": 86
          },
          "B": {
            "r": 28,
            "g": 98,
            "b": 172
          }
        }
      }
    },
    "f": {
      "photo": "face-f.jpg",
      "readings": [
        [
          182,
          202,
          47
        ],
        [
          165,
          168,
          163
        ],
        [
          178,
          178,
          177
        ],
        [
          0,
          62,
          124
        ],
        [
          42,
          163,
          69
        ],
        [
          184,
          54,
          63
        ],
        [
          238,
          95,
          60
        ],
        [
          40,
          159,
          67
        ],
        [
          26,
          151,
          57
        ],
        [
          12,
          57,
          112
        ],
        [
          190,
          213,
          42
        ],
        [
          187,
          197,
          197
        ],
        [
          245,
          97,
          63
        ],
        [
          4,
          56,
          112
        ],
        [
          192,
          211,
          40
        ],
        [
          0,
          54,
          110
        ]
      ],
      "confidences": [
        98,
        85,
        94,
        99,
        96,
        93,
        96,
        96,
        96,
        96,
        97,
        92,
        95,
        96,
        97,
        95
      ],
      "source": "camera",
      "capturedAt": "2026-09-27T09:06:20.235Z",
      "background": {
        "r": 120.59568463282748,
        "g": 94.95280306994593,
        "b": 82.77723704866563
      },
      "frame": {
        "width": 1920,
        "height": 1080
      },
      "crop": {
        "x": 743,
        "y": 323,
        "width": 440,
        "height": 440
      },
      "sharpness": 50.2,
      "camera": {
        "aspectRatio": 1.7777777777777777,
        "backgroundBlur": false,
        "frameRate": 30,
        "height": 1080,
        "resizeMode": "none",
        "width": 1920
      },
      "previewColorProfile": {
        "id": "generic-colors",
        "name": "Generic colors",
        "colors": {
          "W": {
            "r": 174,
            "g": 186,
            "b": 206
          },
          "Y": {
            "r": 179,
            "g": 202,
            "b": 73
          },
          "O": {
            "r": 217,
            "g": 87,
            "b": 66
          },
          "R": {
            "r": 176,
            "g": 41,
            "b": 71
          },
          "G": {
            "r": 46,
            "g": 166,
            "b": 86
          },
          "B": {
            "r": 28,
            "g": 98,
            "b": 172
          }
        }
      }
    },
    "d": {
      "photo": "face-d.jpg",
      "readings": [
        [
          165,
          33,
          50
        ],
        [
          1,
          46,
          97
        ],
        [
          8,
          137,
          40
        ],
        [
          241,
          87,
          36
        ],
        [
          202,
          205,
          52
        ],
        [
          189,
          212,
          51
        ],
        [
          34,
          154,
          60
        ],
        [
          230,
          89,
          46
        ],
        [
          185,
          187,
          186
        ],
        [
          22,
          147,
          49
        ],
        [
          187,
          209,
          31
        ],
        [
          163,
          23,
          34
        ],
        [
          195,
          201,
          202
        ],
        [
          183,
          190,
          190
        ],
        [
          189,
          211,
          34
        ],
        [
          1,
          50,
          106
        ]
      ],
      "confidences": [
        93,
        90,
        90,
        97,
        94,
        97,
        97,
        97,
        96,
        95,
        98,
        93,
        88,
        96,
        97,
        93
      ],
      "source": "camera",
      "capturedAt": "2026-09-27T09:06:22.856Z",
      "background": {
        "r": 121.94851085660409,
        "g": 95.05120490280358,
        "b": 81.4891364632151
      },
      "frame": {
        "width": 1920,
        "height": 1080
      },
      "crop": {
        "x": 708,
        "y": 339,
        "width": 435,
        "height": 435
      },
      "sharpness": 42.3,
      "camera": {
        "aspectRatio": 1.7777777777777777,
        "backgroundBlur": false,